,text,summary
100,"Не исключено, что в ближайшие же дни многие россияне, доставая кошельки и бумажники в супермаркетах и кассах, испытают некоторые неудобства. Из-за того, что Банк России разработал уточнения к определению ветхости купюр, которые должны изыматься из обращения. Какие бумажные деньги вскоре станут считать ветхими? С оборванными углами (хватит и одного), если площадь оторванного куска превысит 32 кв. мм. Под критерии подойдет купюра с оторванным куском 7х5 мм, 6х6 мм и т.д. Если из-за оторванного края — не важно, по длине или ширине, — размеры банкноты уменьшатся на 5 мм и более, то она также будет ветхой. Из оборота будут также изымать купюры, имеющие посторонние штампы (начиная с одного), и посторонние надписи (здесь, правда, если проект реализуется в нынешнем виде, отсчет пойдет от трех знаков или символов). Зато разрывам краев банкноты и сквозным дыркам объявят войну даже при наличии в единственном числе. Главное, чтобы разрыв был длиной более 7 мм, а диаметр дырки составил хотя бы 4 мм. Та же самая ситуация и с пятнами: хватит и одного пятна, если его диаметр дотянет до половины сантиметра. Заклеенные лентой разрывы на бумажных деньгах тоже не спасут их от исключения из обращения. Ветхими признают бумажки, загрязнение которых снизит яркость изображения на 8% и более, а также обесцветившиеся или потертые (к примеру, после стирки). Но волноваться особенно не стоит, поскольку ветхие купюры остаются такими же полноправными средствами платежа, как и их целые собратья. Просто придется ветхие бумажки по номиналу обменять в банке. Так что для собственного удобства лучше постараться их нигде не брать.","Заклеенные лентой разрывы на бумажных деньгах тоже не спасут их от исключения из обращения. Главное, чтобы разрыв был длиной более 7 мм, а диаметр дырки составил хотя бы 4 мм. Просто придется ветхие бумажки по номиналу обменять в банке. "
101,"Одиннадцать бесконечных часов Елена Павловна Белякова металась, не зная, что с дочерью и где она. Морги, больницы… Набрала той самой Кате Барановой, с которой якобы ушла Аня — та ответила что-то невразумительное. — Это был кошмар. Дочь пропала, а люди, с которыми она общалась, делают вид, что чуть ли не в первый раз про Аню слышат… Я побежала к соседу, который работает в правоохранительных органах. Тут раздается странный звонок: “Я — адвокат вашей дочери. Захватите все деньги, которые есть в доме, и подъезжайте на “Октябрьскую”. Сосед просек: “Похоже на похищение. Сейчас организуем вам, Елена Павловна, группу захвата”. Прибыли люди в масках, ее саму обвесили датчиками, пометили купюры, просили не волноваться. В голове одна мысль: “Слава богу, все-таки Анька жива”. …Адвокат оказался с ксивой, которую он по первому требованию предъявил группе захвата: “Все в порядке. Анна Ивановна Белякова задержана 3-м отделом УФСКН Москвы за сбыт наркотиков, 0,9 грамма гашиша, доза сверхмалая, но уголовное дело уже возбуждено”. Дочь встретила ее в камере предварительного заключения. Взгляд мутный, ноги-руки дрожат, по телу синяки, вся мокрая. Обмочилась под себя. “Она просила дать ей лекарства, но ей не поверили, говорили, что она под кайфом”, — объясняет мать. — Знаете, 22 ноября была контрольная закупка в этом клубе — широко освещавшаяся, кстати, в прессе и на ТВ, — пояснил защитник. — Ваша Аня была арестована с поличным”. Князь Дмитрий) (22:28:45 26/11/2008) Ты звезда прям тепер… Пфпфпфф :) Центральные новости. 24 ноября, 15.22 Сотрудники наркоконтроля провели рейд по ночным клубам Москвы. Поймать наркоторговца, признают оперативники, задача непростая. Он редко теряет бдительность и при первой же опасности избавляется от товара. Сколько бы ни отдал за наркотик, знает — свобода дороже. “Нами была получена информация о готовящихся преступлениях, — рассказал заместитель начальника 3-го отдела УФСКН России по ЦАО Москвы Игорь Зуихин. — Мы провели оперативно-разыскное мероприятие — проверочную закупку”. “Меня обвиняют в том, чего не было”, — заявила задержанная Анна Белякова. Анна не знала, что ребята, которые полчаса назад купили у нее гашиш, были не обычными посетителями клуба, а оперативными работниками, подготовившимися к этой операции. — Слушай, я Тимуру подарок приготовила — но стесняюсь передать, можно через тебя? — в клубе Катя протянула Ане маленький пакетик, который на ощупь был похож на пачку сигарет. — Давай, — Аня взяла пакет и положила его в карман кофты. Ничего странного в просьбе подруги, если честно, она не нашла. — Пришел Тимур, Катя шепнула мне: “Отдай, что я просила”. Тимур всучил мне в обратную деньги. “А это Кате”. Я протянула купюры подруге, но та сказала, что у нее заняты руки. Не могла же я бросить деньги на пол… В этот момент к нам подошли люди и сказали, что они снимают кино о профилактике наркомании, а у меня хотят взять интервью. Я сказала: “Как здорово!” Мы прошли в комнату, там было произведено задержание… В пакетике оказался гашиш. Посмотрев Анин паспорт с питерской пропиской, оперативники потерли руки. “Они сказали, что, наверное, я — питерский барыга. Так это и прошло по СМИ. Хотя я в Питере не была много лет”. Согласно показаниям Тимура, который на самом деле был вовсе не Тимур, а Левон Зурабович Лемонджава, в 3-й отдел УФСКН поступила информация от неких агентов о том, что есть девица из Питера по кличке Ксения-Анна. Надо совершить у нее контрольную закупку гашиша помеченными купюрами. Левон-Тимур разыграл операцию как по нотам. Самое удивительное, что никаких следов Димы и Кати Барановой в деле не обнаружилось. Эти ребята, “добровольные помощники УФСКН”, существовали только в Интернете. Красная Шапочка Аня",Хотя я в Питере не была много лет”. Так это и прошло по СМИ. “А это Кате”. 
102,"Эти средства, находившиеся на расчетном счете комитета по финансам и налоговой политике администрации Серпуховского муниципального района, своим постановлением передал на расчетный счет РКЦ МВД 14 декабря прошлого года следователь 2-го отдела СЧ ГСУ А.В.Кудаков. Администрация обратилась в суд с жалобой и требованием признать постановление следователя незаконным, поскольку постановление суда, которым он руководствовался, не вступило в силу и к тому же данный арест повлек бы за собой прекращение финансирования расходов (зарплат, содержания учреждений культуры, образования, здравоохранения и т.д.). В результате суд счел, что следователь не имел права выносить подобное постановление и превысил свои полномочия, и признал постановление незаконным. Напомним, ранее глава администрации Серпуховского района Александр Шестун помог с поличным задержать за получение взятки в 5 млн. рублей бывшего серпуховского прокурора Абросимова и обратился к президенту, рассказав в видеороликах о коррупции в правоохранительных органах.","Эти средства, находившиеся на расчетном счете комитета по финансам и налоговой политике администрации Серпуховского муниципального района, своим постановлением передал на расчетный счет РКЦ МВД 14 декабря прошлого года следователь 2-го отдела СЧ ГСУ А.В.Кудаков. Администрация обратилась в суд с жалобой и требованием признать постановление следователя незаконным, поскольку постановление суда, которым он руководствовался, не вступило в силу и к тому же данный арест повлек бы за собой прекращение финансирования расходов (зарплат, содержания учреждений культуры, образования, здравоохранения и т.д.). рублей бывшего серпуховского прокурора Абросимова и обратился к президенту, рассказав в видеороликах о коррупции в правоохранительных органах. "
103,"Новый законопроект о лекарственных средствах (ЛС) поднял волну негодования. Разрабатывали его, конечно, с благой целью — навести порядок на фармрынке. Но на деле он может поставить крест на бесплатном лекарственном обеспечении россиян. Так считают защитники пациентов и фармэксперты, которые призвали Минздравсоцразвития одуматься и не лишать людей права на здоровье. Согласно недавнему опросу ВЦИОМ, системой лекарственного обеспечения недовольны 64% россиян — за 4 года действия нацпроекта “Здоровье” таких стало в два раза больше. Раньше Правительство РФ хотело разработать систему лекарственного страхования, аналогичную той, что действует в развитых странах, — она позволила бы сделать лекарства более доступными. Но вместо нее появился наделавший шуму законопроект. В нем вообще нет ни слова о том, что в стране должно быть бесплатное и льготное лекарственное обеспечение. Зато красной нитью проходит мысль о том, что нужно регистрировать отпускные цены на жизненно необходимые лекарственные препараты (ЖНВЛС). Если кто-то не успеет зарегистрировать цену на такой препарат — в стране его просто не будет. Ни в госзакупках, ни в аптеках. — О каких ценах на ЖНВЛС вообще может идти речь? Они должны быть бесплатными! — возмущается председатель Общественного совета по правам пациентов при Росздравнадзоре Александр Саверский. К тому же, если государство зарегистрирует отпускную цену, снизить ее потом уже будет невозможно, что противоречит законам рынка. А между тем цены на антиретровирусные препараты для лечения СПИДа за последние годы сами по себе упали в 12 раз! Любопытны и положения закона о проведении клинических исследований новых препаратов. Оказывается, это могут делать только их производители. При этом проверку эффективности и безопасности лекарственных средств должен проводить некий государственный эксперт, получающий деньги от... их разработчика. Это, кстати, у нас давно практикуется. Итог: Россия наводнена препаратами, не зарегистрированными более нигде. Например, у нас разрешен препарат австрийской фирмы, запрещенный в самой Австрии. А с 2003 года зарегистрирован как лекарство от всех видов онкологии некий китайский растительный препарат с не доказанной нигде в мире эффективностью. Также закон резко расширяет возможности проведения клинических исследований на детях и психических больных (за последних решение должен принимать их опекун, которым в интернатах является главврач). — Этим законом нас хотят как стадо баранов загнать в платную медицину, — считает зампред Формулярного комитета РАМН, президент Общества фармакологических исследований Павел Воробьев. По его словам, ни в одной стране не регистрируют отпускные цены на лекарства — там их либо оплачивает государство, либо выдают за символическую цену в рамках страховой медицины. — Мы дикая страна, которая торгует лекарствами и здоровьем своих пациентов! — считает г-н Воробьев. — Государство решило вообще сбросить с себя эту социальную функцию — обеспечение лекарствами. Ее хотят отдать в руки субъектов Федерации, у большинства из которых нет денег на дорогостоящие препараты. А недавно у нас сократили перечень ЖНВЛС — по данным Формулярного комитета, из него исчезли 200 препаратов для лечения многих серьезных заболеваний. “Этот закон явно не в интересах пациентов”, — подытожили “МК” эксперты. Но они сильно сомневаются, что власти откажутся от принятия столь “взяткоемкого” и “усиливающего коррупцию” закона. “Экспертов у нас не слышат и слышать не хотят”, — говорят защитники пациентов.","Но вместо нее появился наделавший шуму законопроект. Это, кстати, у нас давно практикуется. Новый законопроект о лекарственных средствах (ЛС) поднял волну негодования. "
104,"С этого года все вновь возводимые в мегаполисе образовательные учреждения должны стать удобными для ребят с проблемным здоровьем. Как сообщили “МК” в мэрии Москвы, планируется разработать новые типовые проекты как общеобразовательных школ, так и детских садов. Главной задачей для архитекторов станет создание комфортной среды в зданиях для детей с ограниченными физическими возможностями. Они должны будут предусмотреть пандусы, специальные лифты, подъемники и другие приспособления для инвалидов. До конца января чиновники от образования должны выдать Москомархитектуре технические задания на разработку новых типов школ и детсадов. Архитекторы к началу апреля выберут лучшие варианты проектов образовательных учреждений так называемого инклюзивного типа. А существующие проекты школ и детских садов будут скорректированы в соответствии с новыми условиями.","С этого года все вновь возводимые в мегаполисе образовательные учреждения должны стать удобными для ребят с проблемным здоровьем. Как сообщили “МК” в мэрии Москвы, планируется разработать новые типовые проекты как общеобразовательных школ, так и детских садов. До конца января чиновники от образования должны выдать Москомархитектуре технические задания на разработку новых типов школ и детсадов. "
105,"А если человека поймают с 30 граммами, провести в местах не столь отдаленных ему придется не один год. Как сообщили “МК” в аппарате Белого дома, список наркотических средств и психотропных веществ, оборот которых в России запрещен, дополнен почти тремя десятками позиций. В основном это сложные производные от нескольких видов наркотических веществ. Есть в списке и наиболее сильный из растительных галлюциногенов сальвинорин А (по силе в 10 раз превосходит псилоцибин и по активности приближается к полусинтетическому LSD). Попали сюда также скандально известные составляющие курительных смесей — семена розы гавайской, цветки и листья голубого лотоса, лист шалфея предсказателей. Примечательно, что утверждены и дозировки, за которые предусмотрено уголовное преследование. Для лотоса, розы и шалфея крупным размером считается 3 грамма (количество определяется после высушивания при температуре +110—115 градусов), особо крупным — 30 г. Нельзя также выращивать у себя в огороде или дома больше 9 растений этих трех видов.","Для лотоса, розы и шалфея крупным размером считается 3 грамма (количество определяется после высушивания при температуре +110—115 градусов), особо крупным — 30 г. Нельзя также выращивать у себя в огороде или дома больше 9 растений этих трех видов. Как сообщили “МК” в аппарате Белого дома, список наркотических средств и психотропных веществ, оборот которых в России запрещен, дополнен почти тремя десятками позиций. А если человека поймают с 30 граммами, провести в местах не столь отдаленных ему придется не один год. "
