,text,summary
113,"С резкой критикой обрушился на партию власти “Единая Россия” экс-премьер страны, а ныне президент Торгово-промышленной палаты РФ Евгений Примаков. Впрочем, говорить о переходе бывшего главы правительства в ряды радикальной оппозиции преждевременно. Выступая на праздновании старого Нового года перед несколькими сотнями представителей элиты, Примаков раздал по серьгам всем без исключения сестрам: и Кремлю с Белым домом, и большому бизнесу, и демократам-мечтателям. Мы за бедных, мы за бизнес, мы за все, что только можно, — одним из главных козырей своей идеологической программы боссы “ЕдРа” искренне считают ее всеохватность. В глазах Примакова это, напротив, грандиозный минус: “Идеологическая всеядность “Единой России” на практике исключает партийный плюрализм в нашей стране. Создание по сути моноцентристской партийно-государственной системы, даже при наличии на политическом поле многих партий, блокирует демократический процесс”. По мнению экс-премьера, рокировки у руля власти на Западе социал-демократических и консервативных сил “помогают избежать на государственном уровне вредных крайностей”. Но раз “ЕР” — это и правые и левые в одном флаконе, то у нас страховочного механизма не существует. Не менее жесткие слова Примаков нашел и для нашего олигархического бизнеса. Ссылаясь на другого экс-премьера, главу Счетной палаты Степашина, Примаков, по сути, обвинил бизнес-магнатов в многомиллиардном жульничестве: “Осенью 2008 года, когда наступление кризиса стало очевидным, крупные российские корпорации провели внеочередные собрания акционеров, на которых решили выплатить значительные суммы в виде “промежуточных” дивидендов”. После этого, по свидетельству двух бывших шефов Белого дома, воротилы запросили финансовой помощи у государства, в ряде случае ее получили и продолжили “красивую жизнь” за наш с вами счет. Назвал Примаков и главную причину того, почему все разговоры о модернизации нашей экономики пока остаются лишь сотрясением воздуха. Это “инерционное мышление весьма влиятельных кругов, которые уповают на то, что основные импортеры нефти постепенно выходят из рецессии и цены на нефть удержатся на достаточно высоком уровне”. Если выражаться совсем простым языком, то такая экономическая стратегия сводится к тому, чтобы переждать кризис на подкожном жире, а потом зажить как прежде. По мнению Примакова, при сохранении подобного курса мы неизбежно станем “сырьевым придатком не только Запада, но и Китая”. Выставив жирную “тройку” российской власти, Евгений Примаков принялся за оппозиционеров, выдвигающих в качестве обязательного предварительного условия экономической модернизации “идею слома сложившейся политической структуры”. По мнению Примакова, призывы к очередной революции “контрпродуктивны”: они могут расколоть общество и “создать ситуацию, когда вообще будет не до модернизации”. Естественно, бывший премьер не только критиковал, но и вносил конкретные предложения. По идее Примакова, государство должно поощрять приобретение за границей не нового современного оборудования, а патентов на его производство. Легче всего это сделать, по мнению Евгения Максимовича, с помощью налоговых льгот. В своей речи Евгений Примаков, конечно, не “открыл никаких Америк”. Но он сумел без крена в ту или иную сторону нарисовать вполне объективный портрет современной России со всеми ее проблемами. Очень важно и то, что 80-летний “политический тяжеловес” уже давно не претендует на власть и не может восприниматься обитателями Кремля и Белого дома как конкурент. Примаков претендует лишь на то, что и так ему уже принадлежит: право говорить правду в лицо и нашим правителям, и их противникам.","Ссылаясь на другого экс-премьера, главу Счетной палаты Степашина, Примаков, по сути, обвинил бизнес-магнатов в многомиллиардном жульничестве: “Осенью 2008 года, когда наступление кризиса стало очевидным, крупные российские корпорации провели внеочередные собрания акционеров, на которых решили выплатить значительные суммы в виде “промежуточных” дивидендов”. Назвал Примаков и главную причину того, почему все разговоры о модернизации нашей экономики пока остаются лишь сотрясением воздуха. В глазах Примакова это, напротив, грандиозный минус: “Идеологическая всеядность “Единой России” на практике исключает партийный плюрализм в нашей стране. "
114,"Душегуб так и не открыл служителям Фемиды, что заставило его пролить кровь. Как уже сообщал “МК”, страшное преступление произошло в июне 2007 года в Южном округе столицы. Сотрудники милиции прибыли в один из жилых домов по вызову 18-летнего первокурсника мединститута Леонида Одинокова, который сообщил о нападении грабителей на его семью. У парня были ножевые раны на руках, ноге и животе. В квартире стражи порядка обнаружили тела его матери Галины и младшего брата Евгения. По словам Леонида, преступники убили их, а его ударили, после чего он потерял сознание. Однако парень путался в показаниях, и очень скоро выяснилось, что историю с грабителями Одиноков выдумал. Он пытался скрыть от милиции, что убийство матери и брата — дело его рук. В роковой день Леонид вернулся домой после занятий и поругался с младшим братом. К слову, между ними долгое время были натянутые отношения. На сей раз ссора закончилась дракой, в ходе которой Леонид смертельно ранил Евгения складным ножом. После этого он отправил матери сообщение, что Жене стало плохо. Обеспокоенная Галина быстро приехала домой. Здесь Леонид набросился на мать и до смерти забил ее молотком. Следователи выяснили, что Одиноков, убив брата, испугался, что мама сообщит на него в милицию. И Леонид избавился от родного человека как от возможного свидетеля. Но преступник так и не рассказал следствию о причинах ссоры с братом. Кстати, молодой человек некогда лечился в психбольнице — он страдал временным психическим расстройством. Можно было бы предположить, что и в день убийства парень не отдавал отчета в своих действиях. Однако, как сообщила “МК” гособвинитель Мосгорпрокуратуры Наталья Костюк, экспертиза показала, что студент был вменяем. Мосгорсуд приговорил Одинокова к 17 годам колонии строгого режима.","Сотрудники милиции прибыли в один из жилых домов по вызову 18-летнего первокурсника мединститута Леонида Одинокова, который сообщил о нападении грабителей на его семью. Однако парень путался в показаниях, и очень скоро выяснилось, что историю с грабителями Одиноков выдумал. Здесь Леонид набросился на мать и до смерти забил ее молотком. "
115,"По его вине в военных хранилищах в Московской области был проведен некачественный ремонт по завышенным ценам, из-за чего одно из строений обрушилось. Как сообщили “МК” в Военном следственном управлении СКП РФ, полковник запаса Владимир Сабатовский был наказан на 3 года колонии общего режима по уголовной статье о превышении должностных полномочий. В 2003 году Сабатовский добился того, чтобы вышестоящее начальство выделило немалые деньги на капремонт хранилищ вверенной ему воинской части (она располагалась в Балашихинском районе Подмосковья). Затем полковник обратился в фирму “Поток”, занимавшуюся ремонтными работами. Кстати, он выбрал частную организацию вне конкурса, чего не имел права делать. Представители компании потребовали за свои услуги 20 млн. рублей. Как выяснилось позже, цена была значительно завышена. Ошибка Сабатовского заключалась еще и в том, что он не привлек специалистов-экспертов из проектных, научных или ремонтно-строительных организаций. Они бы точно назвали стоимость ремонта. В результате фирмачам заплатили огромную сумму. А комиссия, проверявшая работу строителей, состояла из людей некомпетентных. Ревизоры не смогли определить, что рабочие использовали некачественные материалы. Спустя три года в одном из хранилищ появились трещины в стенах, после чего стали выпадать кирпичи. В конце концов несущие стены здания рухнули. Другие хранилища тоже находятся под угрозой обрушения. В результате правоохранительные органы привлекли Сабатовского к ответственности. Также в течение 2 лет он не сможет занимать должности, связанные с административно-распорядительными и хозяйственными полномочиями. Как сообщил “МК” руководитель пресс-службы Московского окружного военного суда Александр Минчановский, при назначении наказания суд учел обстоятельства, смягчающие вину Сабатовского, — наличие государственных наград, а также почетного звания “Заслуженный военный специалист РФ”.","Как выяснилось позже, цена была значительно завышена. В результате фирмачам заплатили огромную сумму. А комиссия, проверявшая работу строителей, состояла из людей некомпетентных. "
116,"Предполагается, что уже ближайшей весной первые пары смогут посадить свое “дерево счастья” в парках и скверах. Как пояснили “МК” в Департаменте природопользования и охраны окружающей среды столицы, в Москве традиция сажать деревья существовала во времена СССР. По словам старожила природно-исторического парка “Кузьминки-Люблино” лесничего Михаила Смирнова, в 80-х годах прошлого века инициатором посадки деревьев молодоженами выступал райком партии, а явка на “мероприятие” была строго обязательной. Теперь поддержание традиции будет добровольным делом, но экологи уверены, что воспользоваться возможностью посадить дерево захотят многие молодожены. Это будет не только первым совместным занятием молодых супругов, но и выполнением первого “жизненного задания” мужчины — посадить дерево. Скорее всего в первое время услуга будет совершенно бесплатной, в дальнейшем, возможно, с молодоженов будут брать символическую плату за саженцы. В парке “Кузьминки-Люблино” парам предложат саженцы липы и каштана, которые можно будет посадить рядом с Плотиной Влюбленных у Верхнего Кузьминского пруда. В Измайловском парке счастливцы будут высаживать сосну и ель на берегу Красного пруда, а в парке “Дубки” природного заказника “Петровско-Разумовское” “деревьями счастья” будут дубы и ивы.","По словам старожила природно-исторического парка “Кузьминки-Люблино” лесничего Михаила Смирнова, в 80-х годах прошлого века инициатором посадки деревьев молодоженами выступал райком партии, а явка на “мероприятие” была строго обязательной. Предполагается, что уже ближайшей весной первые пары смогут посадить свое “дерево счастья” в парках и скверах. В парке “Кузьминки-Люблино” парам предложат саженцы липы и каштана, которые можно будет посадить рядом с Плотиной Влюбленных у Верхнего Кузьминского пруда. "
117,"Он был задержан после встречи с посредником, которому передал деньги для помощи преступникам, находящимся за решеткой. Как рассказали “МК” в пресс-службе МУРа, 46-летний выходец из Грузии, имеющий в своей биографии 8 судимостей за карманные кражи на родине, руководил в Москве шайками карманников. Около месяца назад по оперативным каналам сыщикам стало известно, что криминальный генерал снабжает деньгами и наркотиками преступников, находящихся в следственных изоляторах и колониях. Милиционерам с трудом удалось вычислить место нахождения Бачука, после чего за уголовником была установлена слежка. Задержать “законника”, хранившего при себе больше 5 граммов героина, удалось в ресторане на Садовой-Триумфальной улице, где он должен был встретиться с единомышленником, чтобы передать деньги и наркоту в воровской общак. По словам специалистов, Пачулия считается вором старой формации. Он больше 18 лет провел в неволе, является одним из предводителей потийской (по названию грузинского порта Поти) этнической преступной группировки. Законник поддерживал квалификацию, лично совершая карманные кражи в Москве.","Как рассказали “МК” в пресс-службе МУРа, 46-летний выходец из Грузии, имеющий в своей биографии 8 судимостей за карманные кражи на родине, руководил в Москве шайками карманников. Задержать “законника”, хранившего при себе больше 5 граммов героина, удалось в ресторане на Садовой-Триумфальной улице, где он должен был встретиться с единомышленником, чтобы передать деньги и наркоту в воровской общак. Милиционерам с трудом удалось вычислить место нахождения Бачука, после чего за уголовником была установлена слежка. "
118,"Как рассказал “МК” оперуполномоченный УВД ЗАО Павел Уралов, неприятный инцидент произошел около 3.00, когда 55-летний москвич Борис вместе с супругой спокойно спал в съемной квартире. По предварительным данным, неизвестный, разбив оконное стекло, забросил в жилище взрывпакет. От мощного хлопка в квартире вылетели все стекла, развалилась кухонная мебель, образовались трещины на стыках железобетонных стен. Сонные супруги отделались лишь испугом. Милиционеры не исключают, что преступление было совершено из хулиганских побуждений. По другой версии, взрыв мог быть акцией устрашения или местью главе семейства — мужчина ранее привлекался к уголовной ответственности за незаконное хранение оружия и боеприпасов, а также за оскорбление сотрудника милиции. Следователи выдвинули гипотезу о том, что взрывпакет хранился в жилище и сработал по вине самого хозяина квартиры. А информацию о злоумышленнике выдумал сам пострадавший, дабы избежать ответственности за хранение взрывчатки.","Сонные супруги отделались лишь испугом. А информацию о злоумышленнике выдумал сам пострадавший, дабы избежать ответственности за хранение взрывчатки. По предварительным данным, неизвестный, разбив оконное стекло, забросил в жилище взрывпакет. "
